[
  {
    "matrixId": "matrix-gene-expression-001",
    "expressionUnitAndScale": {
      "unit": "TPM",
      "scale": "linear"
    },
    "featureType": [
      {
        "id": "SO:0000704",
        "label": "gene"
      }
    ],
    "annotation": {
      "source": "ensembl",
      "version": "109"
    },
    "assembly": {
      "accession": "GCA_000001405.29",
      "name": "GRCh38.p14"
    },
    "reproducible": false,
    "name": "Demo gene expression matrix",
    "dimensions": {
      "features": 2,
      "biosamples": 2
    }
  },
  {
    "createDateTime": "2016-11-08T00:00:00Z",
    "matrixId": "GSE88557",
    "downloadUrl": "https://www.ncbi.nlm.nih.gov/geo/download/?type=rnaseq_counts&acc=GSE88557&format=file&file=GSE88557_raw_counts_GRCh38.p13_NCBI.tsv.gz",
    "featureType": [
      {
        "id": "SO:0000704",
        "label": "gene"
      }
    ],
    "expressionUnitAndScale": {
      "unit": "raw",
      "scale": "linear"
    },
    "description": "Bulk RNA-seq from sigmoid colon (ENCODE/GEO demo fixture).",
    "assayType": {
      "id": "OBI:0003090",
      "label": "bulk RNA-seq assay"
    },
    "name": "total RNA-seq from sigmoid colon (ENCSR812AKX)",
    "dimensions": {
      "features": 39376,
      "biosamples": 1
    },
    "annotation": {
      "source": "ncbigene",
      "version": "109.20190905"
    },
    "assembly": {
      "accession": "GCA_000001405.29",
      "name": "GRCh38.p14"
    },
    "reproducible": true
  }
]
